{
  "schema_version": "1.1",

  "story_meta": {
    "title": "숲 속 서있는 사람 · orbit_ccw",
    "logline": "낮의 숲, 성인 남성이 서있고 카메라가 90° 반시계 orbit.",
    "aspect_ratio": "16:9"
  },

  "characters": [
    {
      "character_id": "standing_person",
      "kind": "adult",
      "reference_description": "성인 남성 1인, 신장 175cm, 캐주얼 복장, 정면 서 있는 자세",
      "reference_image_path": null
    }
  ],

  "locations": [
    {
      "location_id": "forest_day",
      "description": "낮 시간의 활엽수 숲, 부드러운 자연광, 잎이 무성한 나무들 여섯 그루, 흙바닥."
    }
  ],

  "panels": [
    {
      "panel_id": "p001",
      "source_image_path": null,
      "location_id": "forest_day",
      "camera_state": {
        "shot_type": "wide",
        "angle_type": "eye_level",
        "dutch_tilt_deg": 0,
        "focal_length_mm": 35.0,
        "estimated_pose": { "fov_deg": null, "confidence": null }
      },
      "characters_in_frame": [
        {
          "character_id": "standing_person",
          "final_role": "adult man standing calmly among trees, facing forward, casual clothes",
          "pose_category": "standing",
          "screen_position": { "x": 0.500, "y": 0.730 },
          "estimated_transform": { "depth_m": 6.325, "yaw_deg": 180 }
        }
      ],
      "props_in_frame": [
        {"name": "forest_ground", "shape": "grid_plane",
         "final_role": "forest floor with dirt and scattered leaves",
         "screen_position": {"x": 0.500, "y": 0.596},
         "estimated_transform": {"depth_m": 8.246, "yaw_deg": 0, "scale_m": [30.0, 30.0, 1.0]}},
        {"name": "tree_a_trunk", "shape": "cylinder",
         "final_role": "leafy tree trunk, dark brown bark",
         "screen_position": {"x": 0.904, "y": 0.252},
         "estimated_transform": {"depth_m": 9.201, "yaw_deg": 0, "scale_m": [0.35, 0.35, 3.2]}},
        {"name": "tree_a_canopy", "shape": "sphere",
         "final_role": "leafy tree canopy, green foliage",
         "screen_position": {"x": 0.925, "y": -0.227},
         "estimated_transform": {"depth_m": 9.367, "yaw_deg": 0, "scale_m": [1.8, 1.8, 1.8]}},
        {"name": "tree_b_trunk", "shape": "cylinder",
         "final_role": "leafy tree trunk, dark brown bark",
         "screen_position": {"x": 0.071, "y": 0.257},
         "estimated_transform": {"depth_m": 8.741, "yaw_deg": 0, "scale_m": [0.35, 0.35, 3.2]}},
        {"name": "tree_b_canopy", "shape": "sphere",
         "final_role": "leafy tree canopy, green foliage",
         "screen_position": {"x": 0.047, "y": -0.253},
         "estimated_transform": {"depth_m": 8.916, "yaw_deg": 0, "scale_m": [1.8, 1.8, 1.8]}},
        {"name": "tree_c_trunk", "shape": "cylinder",
         "final_role": "leafy tree trunk further back, dark brown bark",
         "screen_position": {"x": 0.992, "y": 0.233},
         "estimated_transform": {"depth_m": 12.305, "yaw_deg": 0, "scale_m": [0.35, 0.35, 3.2]}},
        {"name": "tree_c_canopy", "shape": "sphere",
         "final_role": "leafy tree canopy further back, green foliage",
         "screen_position": {"x": 1.011, "y": -0.134},
         "estimated_transform": {"depth_m": 12.429, "yaw_deg": 0, "scale_m": [1.8, 1.8, 1.8]}},
        {"name": "tree_d_trunk", "shape": "cylinder",
         "final_role": "leafy tree trunk further back, dark brown bark",
         "screen_position": {"x": -0.015, "y": 0.236},
         "estimated_transform": {"depth_m": 11.860, "yaw_deg": 0, "scale_m": [0.35, 0.35, 3.2]}},
        {"name": "tree_d_canopy", "shape": "sphere",
         "final_role": "leafy tree canopy further back, green foliage",
         "screen_position": {"x": -0.036, "y": -0.149},
         "estimated_transform": {"depth_m": 11.989, "yaw_deg": 0, "scale_m": [1.8, 1.8, 1.8]}},
        {"name": "tree_e_trunk", "shape": "cylinder",
         "final_role": "distant tree trunk behind person",
         "screen_position": {"x": 0.646, "y": 0.222},
         "estimated_transform": {"depth_m": 13.653, "yaw_deg": 0, "scale_m": [0.35, 0.35, 3.2]}},
        {"name": "tree_e_canopy", "shape": "sphere",
         "final_role": "distant tree canopy behind person",
         "screen_position": {"x": 0.651, "y": -0.076},
         "estimated_transform": {"depth_m": 13.766, "yaw_deg": 0, "scale_m": [1.8, 1.8, 1.8]}},
        {"name": "tree_f_trunk", "shape": "cylinder",
         "final_role": "distant tree trunk behind person",
         "screen_position": {"x": 0.333, "y": 0.224},
         "estimated_transform": {"depth_m": 13.191, "yaw_deg": 0, "scale_m": [0.35, 0.35, 3.2]}},
        {"name": "tree_f_canopy", "shape": "sphere",
         "final_role": "distant tree canopy behind person",
         "screen_position": {"x": 0.328, "y": -0.086},
         "estimated_transform": {"depth_m": 13.307, "yaw_deg": 0, "scale_m": [1.8, 1.8, 1.8]}}
      ],
      "lighting": {"time_of_day": "midday", "notes": "부드러운 자연광, 잎 사이로 산광"},
      "seedance_prompt_fragment": "adult man standing calmly in leafy forest, six trees around him, soft midday natural light"
    }
  ],

  "shots": [
    {
      "shot_id": "s001",
      "panel_ids": ["p001"],
      "duration_sec": 6.0,
      "continuous_take": false,
      "camera_keyframes": [
        {"t_sec": 0.0, "pos_world": [0.00, -6.00, 2.0], "look_at_world": [0.0, 0.0, 0.85],
         "easing": "EASE_IN", "easing_curve": "SINE", "hold": false,
         "dutch_tilt_deg": 0, "fov_deg": null, "fov_confidence": null,
         "focal_length_mm": 35.0, "shot_type": "wide"},
        {"t_sec": 1.5, "pos_world": [2.30, -5.54, 2.0], "look_at_world": [0.0, 0.0, 0.85],
         "easing": "LINEAR", "easing_curve": "SINE", "hold": false,
         "dutch_tilt_deg": 0, "focal_length_mm": 35.0},
        {"t_sec": 3.0, "pos_world": [4.24, -4.24, 2.0], "look_at_world": [0.0, 0.0, 0.85],
         "easing": "LINEAR", "easing_curve": "SINE", "hold": false,
         "dutch_tilt_deg": 0, "focal_length_mm": 35.0},
        {"t_sec": 4.5, "pos_world": [5.54, -2.30, 2.0], "look_at_world": [0.0, 0.0, 0.85],
         "easing": "LINEAR", "easing_curve": "SINE", "hold": false,
         "dutch_tilt_deg": 0, "focal_length_mm": 35.0},
        {"t_sec": 6.0, "pos_world": [6.00,  0.00, 2.0], "look_at_world": [0.0, 0.0, 0.85],
         "easing": "EASE_OUT", "easing_curve": "SINE", "hold": true,
         "dutch_tilt_deg": 0, "focal_length_mm": 35.0}
      ],
      "shot_level_seedance_prompt": "6-second 90° counter-clockwise orbit around an adult man standing in a leafy forest, camera height 2m, radius 6m, focal 35mm, six trees visible in wide framing, soft midday natural light"
    }
  ],

  "scene_meta": {
    "fps": 24,
    "sensor_width_mm": 36.0,
    "min_distance_m": 0.4,
    "fov_confidence_threshold": 0.3
  }
}
